Summary,Blog Name,Tags,Date
Our suffering comes from the expectation that life is supposed to be something more exciting than it is.,thedailyzen,"zen, meditation, buddhism, mindfulness, quotes, spirituality",2017-11-13 06:02:04 GMT
up and at them,catswilleatyou,"goodmorning, levitation, meditation, rising, floating, gif, cinema4d, c4d, art, animation, everyday, artists on tumblr, animators on tumblr, catswilleatyou, 20171106",2017-11-13 05:58:43 GMT
Marker on paper #artoftheday #instaart #markers #sketch #drawing #therapy #workingclass #workbeforework #lubbock #levelland...,michaelshawart82,"outsiderart, workbeforework, meditation, workingclass, drawing, texas, mindfulness, artoftheday, sharpie, tattoos, instaart, therapy, draweveryday, tattooflash, sketch, levelland, markers, lubbock",2017-11-13 05:44:53 GMT
"keep it simple reflect upon the day, allowing yourself observation what choices did u make and why how honest were you did u...",happylittlebeing,"meditation, zen, buddhim",2017-11-13 05:42:32 GMT
2/28 20171113,ultramarka,"7:50am, yoga, meditation",2017-11-13 05:27:06 GMT
I love Saul Williams lyrics. In my opinion he's one of the best poets out there. Weaving through time and space with words that...,i-need-your-discipline,"psychedelic, meditation, author, ohioigers, artistic, quoteoftheday, geniusatwork, lyrics, goodvibesonly, higherawakening, director, psychedelicmoods, spirituality, consciousness, perception, zen, mindfulness, artist, inspirationalpeople, wordporn, slampoetry, universe, spiritualgrowth, consciousliving, poet, songlyrics, songquote, saulwilliams, pictureoftheday, ohio",2017-11-13 05:10:55 GMT
"How to meditate: Normally, you are forced to think about specific things during your day to day activities (red light, talk talk...",the-millennialwitch,"personal, meditation, witch, pagan, meditation explained",2017-11-13 05:04:32 GMT
Found my new #meditation spot! #theotways #thisisaustralia #greatoceanroad #gaia 🙏🏻x,newagehipster333,"gaia, thisisaustralia, greatoceanroad, theotways, meditation",2017-11-13 04:55:47 GMT
"My serious side. #hypnosistalk #meditation 
#MagicAlistair #dubaievents #dubaiEntertainment #dubai 
#dubai...",ali123hypnoali,"meditation, hypnosistalk, dubaientertainment, dubaievents, theguyinthecrazysuit, magicalistair, dubai, 1magic",2017-11-13 04:55:42 GMT
3 of me.   #benbrowne #kundalini #water #photography #cymatics #cymatic #energy #metatronscube #sacredgeometry #geometry...,benbrowne82,"nassimharamein, benbrowne, meditation, photography, water, sinewave, thrive, cymatic, cymatics, floweroflife, fractals, eggoflife, goldenratio, vibration, spirituality, toroid, kundalini, phi, energy, consciousness, light, geometry, sacredgeometry, fibonacci, art, vortex, sound, metatronscube, mandala",2017-11-13 04:18:39 GMT
